{
  "$schema": "http://json-schema.org/draft-07/schema#",
  "title": "sbom-sentinel configuration",
  "description": "Configuration file for sbom-sentinel — automated SBOM generation and vulnerability scanning.",
  "type": "object",
  "required": ["repos"],
  "additionalProperties": false,
  "properties": {
    "$schema": {
      "type": "string",
      "description": "JSON Schema reference. Used by editors for autocompletion and validation."
    },
    "manufacturer": {
      "type": "string",
      "description": "Organization or manufacturer name embedded in the generated CycloneDX SBOMs.",
      "examples": ["My Company, S.L.", "Acme Corp"]
    },
    "outputDir": {
      "type": "string",
      "description": "Directory where SBOM artifacts and reports are written. Can be overridden with the SENTINEL_OUTPUT_DIR environment variable.",
      "default": "./artifacts",
      "examples": ["./artifacts", "/var/sbom-output"]
    },
    "notifications": {
      "type": "object",
      "description": "Notification settings. Credentials (webhook URL, SMTP password) are provided via environment variables.",
      "additionalProperties": false,
      "properties": {
        "onVulnerabilities": {
          "type": "boolean",
          "description": "Send a notification when CRITICAL or HIGH vulnerabilities are found.",
          "default": true
        },
        "onErrors": {
          "type": "boolean",
          "description": "Send a notification when one or more repositories fail to scan.",
          "default": true
        },
        "slack": {
          "type": "object",
          "description": "Slack notification settings. Set SLACK_WEBHOOK_URL in the environment.",
          "additionalProperties": false,
          "properties": {
            "enabled": {
              "type": "boolean",
              "description": "Enable Slack notifications.",
              "default": false
            }
          }
        },
        "email": {
          "type": "object",
          "description": "Email notification settings. Set SMTP_HOST, SMTP_USER, SMTP_PASS, EMAIL_FROM, EMAIL_TO in the environment.",
          "additionalProperties": false,
          "properties": {
            "enabled": {
              "type": "boolean",
              "description": "Enable email notifications. Requires nodemailer (npm install nodemailer).",
              "default": false
            }
          }
        }
      }
    },
    "tokenExpiry": {
      "type": "object",
      "description": "Optional map of token names to their expiry dates (YYYY-MM-DD). sbom-sentinel logs a warning and sends a notification via all configured channels when a token expires within 15 days.",
      "additionalProperties": {
        "type": "string",
        "pattern": "^\\d{4}-\\d{2}-\\d{2}$",
        "description": "Expiry date in YYYY-MM-DD format."
      },
      "examples": [
        { "BITBUCKET_TOKEN": "2027-04-15", "GITHUB_TOKEN": "2027-06-01" }
      ]
    },
    "sbomExport": {
      "type": "object",
      "description": "SBOM component export settings. Generates a CSV with all scanned components for traceability.",
      "additionalProperties": false,
      "properties": {
        "enabled": {
          "type": "boolean",
          "description": "Generate the SBOM components CSV after each scan. Defaults to true.",
          "default": true
        },
        "filePrefix": {
          "type": "string",
          "description": "Prefix for the CSV filename. Result: {prefix}-YYYY_MM_DD.csv. Only alphanumeric, hyphen, underscore, and dot characters allowed.",
          "default": "sbom-export",
          "pattern": "^[a-zA-Z0-9._-]+$"
        }
      }
    },
    "repos": {
      "type": "array",
      "description": "List of repositories to scan.",
      "minItems": 1,
      "items": {
        "$ref": "#/$defs/RepoConfig"
      }
    }
  },
  "$defs": {
    "RepoConfig": {
      "type": "object",
      "title": "Repository configuration",
      "required": ["name"],
      "additionalProperties": false,
      "properties": {
        "name": {
          "type": "string",
          "minLength": 1,
          "description": "Unique identifier for this repository. Used in report labels and artifact filenames.",
          "examples": ["my-backend", "my-ios-app"]
        },
        "cloneUrl": {
          "type": "string",
          "description": "HTTPS URL used to clone the repository. For private repositories mark the repo with `\"private\": true` and set GITHUB_TOKEN, BITBUCKET_TOKEN, or GIT_TOKEN as appropriate. Not used when mode is 'sbom-repository'.",
          "examples": [
            "https://github.com/myorg/my-backend.git",
            "https://bitbucket.org/myorg/my-repo.git",
            "https://gitlab.com/myorg/my-project.git"
          ]
        },
        "branch": {
          "type": "string",
          "minLength": 1,
          "description": "Branch to clone and scan. Not used when mode is 'sbom-repository'.",
          "examples": ["main", "master", "develop", "release/1.0"]
        },
        "type": {
          "type": "string",
          "description": "Repository ecosystem type. Passed to cdxgen to select the appropriate SBOM generator. Not used when mode is 'sbom-repository'.",
          "enum": ["node", "swift", "gradle", "python", "go", "rust"]
        },
        "mode": {
          "type": "string",
          "description": "SBOM generation mode. 'cdxgen' (default) clones the repository and generates SBOMs with cdxgen. 'command' runs a custom script. 'sbom-repository' reads pre-generated CycloneDX SBOMs from a local directory (requires 'path').",
          "enum": ["cdxgen", "command", "sbom-repository"],
          "default": "cdxgen"
        },
        "path": {
          "type": "string",
          "description": "Required for 'sbom-repository' mode: local directory containing dated sbom-DD-MM-YYYY folders with CycloneDX JSON files. Not used in 'cdxgen' or 'command' modes.",
          "examples": ["/sbom-repo", "/var/sboms"]
        },
        "maxSbomAgeDays": {
          "type": "integer",
          "minimum": 1,
          "description": "Only for 'sbom-repository' mode: maximum age in calendar days (UTC) of the most recent sbom-DD-MM-YYYY folder. If the newest folder is older than this threshold, the scan fails with an error and triggers an onErrors notification. Set to at least 4 to account for weekends. Omit to disable the check.",
          "examples": [4, 7]
        },
        "sbomCommand": {
          "type": "string",
          "description": "Shell command to run when mode is 'command'. Executed in the cloned repository root. Must produce the SBOM file at the path specified by sbomOutput.",
          "examples": ["npm ci && npm run sbom", "gradle cyclonedxBom"]
        },
        "sbomOutput": {
          "type": "string",
          "description": "Relative path (from the repository root) to the SBOM file produced by sbomCommand. Only used when mode is 'command'.",
          "default": "bom.json",
          "examples": ["bom.json", "sbom/bom.json", "build/reports/bom.json"]
        },
        "enabled": {
          "type": "boolean",
          "description": "Set to false to skip this repository without removing it from the config.",
          "default": true
        },
        "private": {
          "type": "boolean",
          "description": "Set to true if this repository requires authentication to clone. sbom-sentinel will verify that the appropriate token (GITHUB_TOKEN, BITBUCKET_TOKEN, or GIT_TOKEN) is configured before starting the scan.",
          "default": false
        },
        "notes": {
          "type": "string",
          "description": "Free-text notes for documentation purposes. Not used by sbom-sentinel.",
          "examples": ["Enable when Package.resolved is committed", "Deprecated — to be removed in Q3"]
        }
      },
      "allOf": [
        {
          "if": {
            "not": {
              "properties": { "mode": { "const": "sbom-repository" } },
              "required": ["mode"]
            }
          },
          "then": {
            "required": ["cloneUrl", "branch", "type"]
          }
        },
        {
          "if": {
            "properties": { "mode": { "const": "sbom-repository" } },
            "required": ["mode"]
          },
          "then": {
            "required": ["path"]
          }
        },
        {
          "if": {
            "properties": { "mode": { "const": "command" } },
            "required": ["mode"]
          },
          "then": {
            "required": ["sbomCommand"],
            "properties": {
              "sbomCommand": {
                "minLength": 1
              }
            }
          }
        }
      ]
    }
  }
}