{
  "manufacturer": "Test Company, S.L.",
  "outputDir": "./artifacts",
  "notifications": {
    "onVulnerabilities": true,
    "onErrors": true,
    "slack": {
      "enabled": false
    },
    "email": {
      "enabled": false
    }
  },
  "repos": [
    {
      "name": "my-backend",
      "cloneUrl": "https://github.com/myorg/my-backend.git",
      "branch": "main",
      "type": "node"
    },
    {
      "name": "my-library",
      "cloneUrl": "https://github.com/myorg/my-library.git",
      "branch": "main",
      "type": "node",
      "mode": "command",
      "sbomCommand": "npm ci && npm run sbom",
      "sbomOutput": "sbom/bom.json"
    },
    {
      "name": "my-ios-app",
      "cloneUrl": "https://github.com/myorg/my-ios-app.git",
      "branch": "main",
      "type": "swift",
      "enabled": false,
      "notes": "Enable when Package.resolved is committed"
    }
  ]
}
